{
  "$schema": "./shard.schema.json",
  "category": "runtime",
  "version": "1.0.0",
  "updated_at": "2026-06-26",
  "lessons": [
    {
      "id": "arkweb-init-engine",
      "stage": "validation",
      "plugin_type": ["all"],
      "symptom": "启动白屏，日志 dlns_create failed errno=17 / libweb_engine.so 加载失败",
      "wrong": "用了 WebView 或依赖 Web 引擎的能力，但 EntryAbility 没预初始化引擎",
      "fix": "EntryAbility.onCreate 里 super.onCreate 后调 webview.WebviewController.initializeWebEngine()",
      "why": "HarmonyOS 6.x 上 ArkWeb 引擎不会自动初始化"
    },
    {
      "id": "webview-controller-must-bind",
      "stage": "validation",
      "plugin_type": ["turbo", "fabric", "cpp"],
      "symptom": "WebviewController 方法(createPdf/loadUrl/runJavaScript)无效或异常",
      "wrong": "new WebviewController() 后直接调方法，controller 未绑定到 UI 树里的 Web 组件",
      "fix": "Index.ets 声明一个隐藏 Web({controller})（.width(1).height(1).visibility(Hidden)），把同一 controller 注入业务类后再用",
      "why": "WebviewController 是 Web 组件的代理，能力依赖与 UI 树中 Web 组件绑定"
    },
    {
      "id": "async-error-handling",
      "stage": "coding",
      "plugin_type": ["turbo", "fabric", "js-only"],
      "symptom": "未处理的 Promise 拒绝/异步异常致崩溃或静默失败",
      "wrong": "TurboModule 返回的 Promise 在 JS 侧无 .catch/try-catch；useEffect/事件回调里的异步无错误处理",
      "fix": "所有异步调用加 .catch 或 try-catch；原生方法失败要 reject 而非吞掉；给用户可见的失败反馈",
      "why": "鸿蒙上异步失败不处理会冒泡成崩溃或让 UI 卡在中间态"
    },
    {
      "id": "null-safety",
      "stage": "coding",
      "plugin_type": ["turbo", "fabric", "cpp"],
      "symptom": "Cannot read property of undefined/null",
      "wrong": "直接访问可能为空的 descriptor/rawProps 字段、可选参数、Map.get 结果",
      "fix": "用 ?./?? 兜底，可选 props 给默认值；ArkTS 读嵌套 Map 须显式 const raw: ESObject|undefined = m.get(k) 再判空",
      "why": "边界数据常为空，未兜底即运行时崩"
    }
  ]
}
