{
  "$schema": "./shard.schema.json",
  "category": "example",
  "version": "1.0.0",
  "updated_at": "2026-06-26",
  "lessons": [
    {
      "id": "example-needs-real-input",
      "stage": "validation",
      "plugin_type": ["fabric", "turbo", "js-only"],
      "symptom": "Example 只见数字/状态变化，核心功能区域空白",
      "wrong": "关键输入(source/uri)写死为空/占位，组件无真实数据可渲染",
      "fix": "给需外部输入的组件(PDF/图片/视频/文件/地图)内置真实样本：rawfile 打包 → EntryAbility 拷到 filesDir → 用真实绝对路径作 source；禁空/占位 source",
      "why": "空输入下原生不加载、配置不生效，按钮只改 React state，无法验证核心功能"
    },
    {
      "id": "example-prop-name-mismatch",
      "stage": "validation",
      "plugin_type": ["fabric", "js-only"],
      "symptom": "组件渲染但关键子元素(如 header)不显示，无报错无崩溃",
      "wrong": "传 HeaderComponent={<H/>} 但库实际要 renderHeader={()=><H/>}（render function vs component 混淆）",
      "fix": "写 App.tsx 前先读组件 Props 类型定义(types.d.ts/源码 interface)，确认 prop 精确名与类型（renderXxx vs XxxComponent、onXxx vs xxxHandler）",
      "why": "传错类型不报编译错，但 prop 为 undefined → 对应部分不渲染"
    },
    {
      "id": "example-alert-prompt-ios-only",
      "stage": "validation",
      "plugin_type": ["js-only", "turbo", "fabric"],
      "symptom": "运行时 Alert.prompt is not a function",
      "wrong": "Example 用 Alert.prompt 弹输入框（iOS 专属 API）",
      "fix": "鸿蒙/Android 只支持 Alert.alert；要输入用 Modal + TextInput；可直接用硬编码示例数据",
      "why": "Alert.prompt 是 iOS-only，其它平台为 undefined"
    },
    {
      "id": "example-stable-urls",
      "stage": "validation",
      "plugin_type": ["js-only", "fabric", "turbo"],
      "symptom": "Example 资源灰色占位/加载失败",
      "wrong": "用 via.placeholder.com / example.com 等占位或不存在的资源",
      "fix": "用稳定可达 URL：图片 https://picsum.photos/{w}/{h}、视频 MDN rabbit320.mp4；优先复用原仓库 example 已验证的 URL",
      "why": "占位图服务在鸿蒙设备 WebView 网络/SSL 受限，常不可达"
    },
    {
      "id": "linking-queryschemes",
      "stage": "validation",
      "plugin_type": ["all"],
      "symptom": "Linking.canOpenURL 恒返回 false / URL 打不开",
      "wrong": "用 Linking.canOpenURL/openURL 但 example module.json5 没声明 querySchemes",
      "fix": "在 example module.json5 的 module 对象加 querySchemes（如 ['https','http', 需要的 scheme]）",
      "why": "鸿蒙 canOpenLink 要求预声明可查询的 URL scheme（类似 iOS LSApplicationQueriesSchemes）"
    }
  ]
}
