{
  "$schema": "./shard.schema.json",
  "category": "arkts",
  "version": "1.0.0",
  "updated_at": "2026-06-26",
  "lessons": [
    {
      "id": "arkts-default-import",
      "stage": "coding",
      "plugin_type": ["turbo", "fabric", "cpp"],
      "symptom": "ArkTS 编译报『无导出成员』/导入到 undefined",
      "wrong": "对默认导出模块用解构导入，如 import { drawing } from '@ohos.graphics.drawing'",
      "fix": "默认导出用默认导入：import drawing from '@ohos.graphics.drawing'；不确定先查 harmonyos-sdk-api-lookup",
      "why": "多数 @ohos.* 模块是默认导出，解构导入取不到符号"
    },
    {
      "id": "arkts-descriptor-private",
      "stage": "coding",
      "plugin_type": ["fabric"],
      "symptom": "ArkTS 编译报错：访问私有/保护属性",
      "wrong": "直接访问 ViewDescriptorWrapperBase 的 descriptor / rawProps / propsSelector",
      "fix": "改用公开 getter：descriptorWrapper.props / .backgroundColor / .borderWidth / .borderColor / .borderRadius / .width / .height / .isClipping",
      "why": "descriptor/rawProps/propsSelector 是私有/保护成员，只能经公开 getter 读"
    },
    {
      "id": "arkui-prop-name-conflict",
      "stage": "coding",
      "plugin_type": ["fabric"],
      "symptom": "编译报 Property 'borderRadius' ... not assignable to base type 'CustomComponent'",
      "wrong": "@Component struct 的属性名用了 ArkUI 内置名：borderRadius / backgroundColor / borderWidth / borderColor",
      "fix": "给属性加前缀避开内置名（如 squircleBorderRadius），或不声明为 @State、用组件内私有变量",
      "why": "@Component 继承 CustomComponent，已内置同名属性方法，重名即类型冲突"
    },
    {
      "id": "rnoh-version-api-drift",
      "stage": "coding",
      "plugin_type": ["turbo", "fabric", "cpp"],
      "symptom": "HAR 编译报『无导出成员』/基类属性不存在 / 运行时某 API 不是函数",
      "wrong": "照搬别处版本的 RNOH/RN 写法——基类(EtsUITurboModule vs UITurboModule)、codegen 类型(ViewProps/Float/Int32)、codegenNativeComponent 导入路径，凭记忆写",
      "fix": "这些随 RNOH/RN 基线变化，不要猜：先查 rn-docs-lookup 确认本工程基线下正确的基类、导入路径(主包 vs /ts 子路径)、codegen 类型模式，再写",
      "why": "RNOH 0.72 与新版的导出集/基类/codegen 类型不同，跨版本照搬必编译或运行失败"
    },
    {
      "id": "fabric-standard-struct",
      "stage": "coding",
      "plugin_type": ["fabric"],
      "symptom": "Fabric 组件不渲染/空白",
      "wrong": "用 @Prop ctx: Record<string, ESObject>、无 tag、无 subscribeToDescriptorChanges、无 EventEmitter 的错误结构",
      "fix": "用 RNOH 标准结构：public ctx!: RNOHContext + public tag + aboutToAppear 里 new EventEmitter + descriptorRegistry.subscribeToDescriptorChanges 接 props + RNViewBase 包裹 UI + aboutToDisappear 清理回调",
      "why": "RNOH 按 RNOHContext+tag 标识实例、靠 subscribe 收 props，结构不对组件不工作"
    },
    {
      "id": "fabric-real-event-payload",
      "stage": "coding",
      "plugin_type": ["fabric"],
      "symptom": "JS 侧事件收到错误/恒定数据",
      "wrong": "事件回调里硬编码 payload（如 emit('onLoad', {width:0, height:0})）",
      "fix": "用 ArkUI 回调提供的真实 event 参数（如 onComplete((e)=> emit('onLoad', {width:e.width, height:e.height}))）",
      "why": "硬编码=假实现；ArkUI 回调本身携带真实运行时数据"
    },
    {
      "id": "arkui-no-colorfilter",
      "stage": "coding",
      "plugin_type": ["fabric", "turbo"],
      "symptom": "编译报 Property 'create' does not exist on ColorFilter / 类型不存在",
      "wrong": "猜用 ColorFilter.create / ColorFilterMatrix（HarmonyOS 无此 API）",
      "fix": "图片着色用 Image().renderMode(ImageRenderMode.Template).fillColor(...)（仅对矢量/模板图有效）；任何不确定 API 先查 harmonyos-sdk-api-lookup 别猜",
      "why": "ArkUI Image 无 ColorFilter 类；凭经验猜 API 是常见失败源"
    },
    {
      "id": "arkui-animation-not-animateto",
      "stage": "coding",
      "plugin_type": ["fabric", "turbo"],
      "symptom": "animateTo is deprecated / not a function",
      "wrong": "用 animateTo({duration}, cb) 改状态做动画",
      "fix": "用组件 .animation({duration, curve}) + @State 变量变化自动触发过渡",
      "why": "animateTo 在鸿蒙已废弃，改用声明式 .animation()"
    }
  ]
}
