{
  "$schema": "./shard.schema.json",
  "category": "review",
  "version": "1.0.0",
  "updated_at": "2026-06-26",
  "lessons": [
    {
      "id": "permission-misjudgment",
      "stage": "both",
      "plugin_type": ["all"],
      "symptom": "hdc install / onDeviceTest 失败：code:9568289 grant request permissions failed",
      "wrong": "盲信 planning 权限映射，声明了受限/ACL 权限或本不需要的权限。典型：为主窗口系统栏 API（setWindowSystemBarProperties / setWindowLayoutFullScreen / setSpecificSystemBarEnabled 等）误声明 ohos.permission.SYSTEM_FLOAT_WINDOW",
      "fix": "按官方 API 文档『需要权限』字段核对再声明；SYSTEM_FLOAT_WINDOW 是悬浮窗受限权限，系统栏 API 不需要；restricted/ACL 权限普通 Example 真机禁声明，误映射就从 entry 与 HAR 的 module.json5 移除",
      "why": "鸿蒙对受限权限有 system_grant/ACL 限制，多声明会导致安装或真机测试直接失败"
    },
    {
      "id": "permission-completeness",
      "stage": "both",
      "plugin_type": ["all"],
      "symptom": "运行时权限相关 API 调用失败/无响应",
      "wrong": "实际用到的权限没在 module.json5 的 requestPermissions 声明，或 user_grant 级权限没写运行时动态申请",
      "fix": "把用到的权限补进 module.json5；user_grant 级权限运行时用 abilityAccessCtrl.requestPermissionsFromUser 申请、授权后再调 API",
      "why": "鸿蒙权限须先声明，user_grant 还须运行时授权才生效"
    },
    {
      "id": "fake-impl-residue",
      "stage": "both",
      "plugin_type": ["all"],
      "symptom": "功能看似实现实则空转（校验 P0 阻断）",
      "wrong": "用固定返回值/空函数/只打日志/测试数据冒充实现，或删原生配置后用空 ETS 顶替，或保留与鸿蒙无关的 Android/iOS 原生残留",
      "fix": "每个公开能力必须有真实鸿蒙实现并经 example 验证；复杂/耗时不是省略理由；查不到 API 先 lookup 再实现，不能假装",
      "why": "假实现在评审是 P0 阻断项，真机必然暴露"
    },
    {
      "id": "resource-release",
      "stage": "coding",
      "plugin_type": ["turbo", "fabric", "cpp"],
      "symptom": "资源泄漏/句柄未释放/内存增长",
      "wrong": "文件流(fileIo)、订阅(emitter / DeviceEventEmitter)、controller 等用完不关/不解绑",
      "fix": "文件流用完 close；emitter.on / DeviceEventEmitter.addListener 保存句柄并在 aboutToDisappear / componentWillUnmount 解绑；组件销毁时执行所有 cleanup 回调",
      "why": "鸿蒙原生资源不自动回收，泄漏致句柄耗尽/内存增长"
    },
    {
      "id": "json-parse-guard",
      "stage": "coding",
      "plugin_type": ["all"],
      "symptom": "JSON.parse 抛异常致流程中断/崩溃",
      "wrong": "对外部/原生来的字符串直接 JSON.parse，无 try-catch、不判空",
      "fix": "JSON.parse 包 try-catch，失败给默认值并记录；解析前判空",
      "why": "非法/空 JSON 会抛异常，未捕获直接中断流程"
    },
    {
      "id": "security-coding",
      "stage": "coding",
      "plugin_type": ["all"],
      "symptom": "安全审查告警（弱算法/明文密钥/日志泄密）",
      "wrong": "用 MD5 等弱摘要做安全用途、Math.random 生成安全随机、硬编码密钥/token、把密钥/凭证打进日志",
      "fix": "安全摘要用 SHA-256+（@kit.CryptoArchitectureKit）、安全随机用 cryptoFramework 的随机源、密钥走安全存储不硬编码、日志脱敏不打凭证",
      "why": "这些是评审固定安全门禁项，违反即阻断"
    }
  ]
}
